{
  "renderer": "manim",
  "format": "horizontal",
  "quality": "preview",
  "scene": {
    "layout": "hero",
    "duration": 22,
    "theme": "dark"
  },
  "slots": {
    "main": {
      "at": 0.0,
      "action": "showPayoffMatrix",
      "params": {
        "id": "pd",
        "size": "medium",
        "players": [
          { "name": "P1", "color": "actor_a" },
          { "name": "P2", "color": "actor_b" }
        ],
        "strategies": [["Cooperate", "Defect"], ["Cooperate", "Defect"]],
        "cells": [
          [{ "a": 3, "b": 3 }, { "a": 0, "b": 5 }],
          [{ "a": 5, "b": 0 }, { "a": 1, "b": 1 }]
        ],
        "timing": "slow",
        "effect": "level-by-level",
        "role": "primary"
      }
    }
  },
  "overlays": [
    { "at": 5.0, "action": "showCalloutBox",
      "params": { "id": "iesds-0", "slot": "main", "subject": "pd:cell:1,0",
        "text": "If P2 cooperates, P1 prefers to defect.",
        "width": 2.6, "style": "neon", "timing": "fast" } },
    { "at": 10.0, "action": "removeComponent",
      "params": { "target": "iesds-0", "effect": "fade-out", "timing": "fast" } },

    { "at": 11.0, "action": "showCalloutBox",
      "params": { "id": "iesds-1", "slot": "main", "subject": "pd:cell:0,1",
        "text": "Symmetric on P2's side.",
        "width": 2.6, "style": "neon", "timing": "fast" } },
    { "at": 16.0, "action": "removeComponent",
      "params": { "target": "iesds-1", "effect": "fade-out", "timing": "fast" } },

    { "at": 17.0, "action": "showCalloutBox",
      "params": { "id": "iesds-2", "slot": "main", "subject": "pd:cell:1,1",
        "text": "Both defect — Nash equilibrium.",
        "width": 2.6, "style": "neon", "timing": "fast" } },
    { "at": 22.0, "action": "removeComponent",
      "params": { "target": "iesds-2", "effect": "fade-out", "timing": "fast" } }
  ],
  "timeline": []
}
