{
  "renderer": "manim",
  "format": "horizontal",
  "quality": "preview",
  "scene": {
    "layout": "hero",
    "duration": 5,
    "theme": "dark"
  },
  "slots": {
    "main": {
      "at": 0.0,
      "action": "showTextCard",
      "params": {
        "id": "target",
        "text": "TARGET",
        "size": "title",
        "timing": "fast",
        "effect": "fade-in"
      }
    }
  },
  "overlays": [
    {
      "at": 1.0,
      "action": "showCalloutBox",
      "params": {
        "id": "above",
        "text": "above:target",
        "anchor": "above:target",
        "width": 2.4,
        "timing": "fast",
        "effect": "fade-in"
      }
    },
    {
      "at": 1.6,
      "action": "showCalloutBox",
      "params": {
        "id": "below",
        "text": "below:target",
        "anchor": "below:target",
        "width": 2.4,
        "timing": "fast",
        "effect": "fade-in"
      }
    },
    {
      "at": 2.2,
      "action": "showCalloutBox",
      "params": {
        "id": "leftof",
        "text": "left-of:target",
        "anchor": "left-of:target",
        "width": 2.4,
        "timing": "fast",
        "effect": "fade-in"
      }
    },
    {
      "at": 2.8,
      "action": "showCalloutBox",
      "params": {
        "id": "rightof",
        "text": "right-of:target",
        "anchor": "right-of:target",
        "width": 2.4,
        "timing": "fast",
        "effect": "fade-in"
      }
    }
  ],
  "timeline": []
}
