{
  "renderer": "manim",
  "format": "horizontal",
  "quality": "preview",
  "scene": {
    "layout": "trio",
    "duration": 9,
    "theme": "dark"
  },
  "slots": {
    "A": {
      "at": 0.0,
      "action": "showIcon",
      "params": {
        "id": "ic-shield", "icon": "shield", "color": "highlight",
        "glow": true, "size": "large",
        "timing": "normal", "effect": "fade-in", "role": "primary"
      }
    },
    "B": {
      "at": 0.3,
      "action": "showIcon",
      "params": {
        "id": "ic-globe", "icon": "globe", "color": "neutral",
        "size": "large",
        "timing": "normal", "effect": "fade-in", "role": "primary"
      }
    },
    "C": {
      "at": 0.6,
      "action": "showIcon",
      "params": {
        "id": "ic-flag", "icon": "flag:ma", "size": "large",
        "timing": "normal", "effect": "fade-in", "role": "primary"
      }
    }
  },
  "overlays": [
    { "at": 4.0, "action": "showIcon",
      "params": { "id": "ic-threat", "anchor": "above:ic-globe",
        "icon": "triangle-alert", "color": "contested", "glow": true,
        "size": "medium", "timing": "fast", "effect": "fade-in" } }
  ],
  "timeline": []
}
